Wann?,Wo?,Ort,Ortsteil,Strasse,Schaden?,Privat,Firma,Gaststätte,Sonstige,Meldung
12/2/2013,Crailsheim,Crailsheim,,Schönebürgstraße,"2,000",,x,,," Am Montagnachmittag schlich sich ein Unbekannter in das Treppenhaus eines Bürogebäudes in der Schönebürgstraße. Er entriegelte im Treppenhaus ein Fenster, das nicht bemerkt wurde. In der Nacht zum Dienstag stieg der Täter über das Fenster ein. Im Obergeschoss des Gebäudes brach er die Eingangstüre zu verschiedenen Büroräumen auf. Er durchsuchte Schränke, Schubladen und Container. Dabei fiel dem Einbrecher Bargeld in die Hände. Der entstandene Sachschaden beläuft sich auf über 2000 Euro."
12/1/2013,Gaildorf,Gaildorf,,Gartenstraße,,x,,,," Schmuck, zwei Computer und Bargeld erbeutete am Sonntag ein Einbrecher in der Gartenstraße. Der Unbekannte brach in der Zeit zwischen 16 Uhr und 19.15 Uhr zunächst eine Tür zum Wintergarten des Hauses auf. Nachdem er dahinter die Terrassentür aufgehebelt hatte, gelangte er in das Haus. Er durchsuchte sämtliche Räume, Schränke und Schubladen. Verschlossene Türen wurden aufgehebelt. Bei dem Einbruch entstand ein Schaden von einigen tausend Euro."
12/1/2013,Schwäbisch Hall,Schwäbisch Hall,,Luckenbacher See ,200,,,,Clubheim,In der Nacht zum Sonntag brach ein Unbekannter in ein Clubheim am Luckenbacher See ein. Der Täter hebelte ein Fenster auf. Er durchsuchte sämtliche Schränke und Schubladen nach Bargeld. Durch den Einbruch entstand ein Schaden von knapp 200 Euro.
11/28/2013,Ilshofen,Ilshofen,,Aspacher Straße,,x,,,," Am Donnerstag, in der Zeit zwischen 13.30 Uhr und 18.30 Uhr,  drangen unbekannte Täter in eine Wohnhaus in der Aspacher Straße ein, indem sie die Terrassentüre aufhebelten. In Abwesenheit der Bewohner durchsuchten sie nahezu sämtliche Räumlichkeiten und entwendeten mehrere hundert Euro sowie Schmuck mit derzeit noch unbekanntem Wert. Der Sachschaden am Gebäude wird mit 500,-- Euro angegeben."
11/28/2013,Crailsheim,Crailsheim,,Staufenstraße,,x,,,, In ein Mehrfamilienhaus in der Staufenstraße in Onolzheim drang ein Unbekannter am Donnerstag ein. In der Zeit zwischen 9.30 Uhr und 20 Uhr hebelte der Täter ein Fenster auf und stieg zunächst in das Treppenhaus ein. Er gelangte in eine unverschlossene Wohnung. Der Einbrecher nahm Bargeld und Schmuck mit. Es entstand ein Schaden von 700 Euro.
11/28/2013,Bühlertann,Bühlertann,,Blumenstraße,,x,,,, Bargeld suchte am Donnerstag ein Einbrecher in einem Wohnhaus in der Blumenstraße. Der Täter hebelte in der Zeit zwischen 12 Uhr und 19.15 Uhr die Terrassentür des Hauses auf. Er drang in das Schlafzimmer ein und durchsuchte es. Dem Einbrecher fiel eine geringe Menge Bargeld in die Hände. Die Höhe des entstandenen Sachschadens steht noch nicht fest.
11/28/2013,Bühlerzell,Bühlerzell,,Wiesenstraße,,x,,,, Schmuck und Münzen erbeutete am Donnerstag ein Einbrecher in einem Haus in der Wiesenstraße. Nach den Ermittlungen der Polizei schlug der Unbekannte zunächst an der Rückseite des Gebäudes einen Bewegungsmelder herunter. Anschließend hebelte er ein Fenster auf. Der Unbekannte durchsuchte das Haus. Nach den bisherigen Feststellungen entstand ein Sachschaden von über 1000 Euro. Der Einbruch wurde um 19.45 Uhr entdeckt.
11/27/2013,Crailsheim,Crailsheim,,Weikstraße,,x,,,," Unbekannte brachen entweder am Dienstag oder am Mittwoch in der Weikstraße in ein Wohnhaus ein. Die Täter brachen die Terrassentür auf. Sie durchsuchten das gesamte Haus. Nach den bisherigen Feststellungen erbeuteten die Einbrecher Bargeld, Schmuck, Uhren und Kreditkarten. Die Höhe des Sachschadens steht noch nicht fest, da sich die Hausbesitzer derzeit im Urlaub befinden."
11/25/2013,Braunsbach,Braunsbach,,Elsenbergstraße,,x,,,," Im Zeitraum vom 23.11.2013 bis 25.11.2013, 16:00 Uhr wurde ein Haus in der Elsenbergstraße durch Einbrecher aufgesucht. Die Hauseigentümerin war zu dieser Zeit nicht zu Hause. Die Einbrecher hinterließen einen Sachschaden in Höhe von 700 Euro."
11/26/2013,Sulzbach-Laufen,Sulzbach,Laufen,Nestelberg  ,"1,500",,,x,,In der Nacht von Montag auf Dienstag brach ein unbekannter Täter in eine Vereinsgaststätte in Nestelberg  ein. Hierbei wurde ein Fenster aufgehebelt. Im Gebäude wurde eine weitere Tür aufgehebelt. Der Einbrecher durchsuchte die Räumlichkeiten und verursachte einen Gesamtschaden in Höhe von 1500 Euro. 
11/26/2013,Schwäbisch Hall,Schwäbisch Hall,,Herrengasse,,,x,,,Gleich zwei Büroräume wurden In der Nacht von Montag auf Dienstag durch Einbrecher aufgesucht. Ein Büro in der Herrengasse und ein weiteres Büro ‚Am Markt‘. Aus den Büroräumen wurde Bargeld entwendet. Die Einbrecher verursachten einen Gesamtschaden in Höhe von 3900 Euro.
11/26/2013,Schwäbisch Hall,Schwäbisch Hall,,Herrengasse,,,x,,,Gleich zwei Büroräume wurden In der Nacht von Montag auf Dienstag durch Einbrecher aufgesucht. Ein Büro in der Herrengasse und ein weiteres Büro ‚Am Markt‘. Aus den Büroräumen wurde Bargeld entwendet. Die Einbrecher verursachten einen Gesamtschaden in Höhe von 3900 Euro.
11/26/2013,Crailsheim,Crailsheim,,am Karlsberg,,,,,Schule, Durch Unbekannte wurde die Realschule am Karlsberg am Dienstag heimgesucht. Gegen 21.10 Uhr wurde ein Fenster geöffnet und die Schule betreten. Die Täter wurden offensichtlich gestört und flüchteten. Neben der Realschule befindet sich eine Großsporthalle. In dieser befanden sich zur gleichen Zeit mehrere Sportler. Das Polizeirevier Crailsheim Telefon. 07951/480-222 bittet um Zeugenhinweise.
11/25/2013,Mainhardt,Mainhardt,,Im Seetal,300,,x,,," Einbrecher suchten in der Nacht auf Montag einen Verbrauchermarkt ‚Im Seetal‘ auf. Der Versuch, die Haupteingangstür aufzuhebeln, misslang jedoch. Durch die Einbrecher wurde ein Schaden von 300 Euro verursacht."
11/25/2013,Crailsheim,Crailsheim,,Zur Flügelau,"5,000",,x,,," Einen hohen Sachschaden hinterließ ein unbekannter Einbrecher an einem Betrieb  in Altenmünster. Der in der Straße ‚Zur Flügelau‘ ansässige Elektrogroßhandel wurde in der Zeit zwischen Sonntag, 14 Uhr auf Montag, 6.20 Uhr durch unbekannte Täter heimgesucht. Der Täter versuchten zunächst eine Eingangstür aufzubrechen. Dies misslang jedoch. Anschließend stieg der Täter über das Tor in den Hofraum und versuchte die Tür eines Rolltores mit brachialer Gewalt aufzuhebeln. Auch dies gelang dem Täter nicht. Der verursachte Sachschaden wird auf 5000 Euro geschätzt."
11/23/2013,Satteldorf,Satteldorf,,Horschhausen ,,x,,,," Unbekannte Täter brachen am Samstag, zwischen 17.00 Uhr und Mitternacht, in Horschhausen in ein Wohnhaus ein. Sie entwendeten einen Tresor und eine Geldkassette mit einem vierstelligen Bargeldbetrag. Zum Abtransport müssen die Täter ein Fahrzeug benutzt haben. Zeugen werden gebeten, sich beim Polizeirevier Crailsheim zu melden."
11/23/2013,Schwäbisch Hall,Schwäbisch Hall,,Spitalbach,500,,x,,,"Unbekannte Täter brachen zwischen Freitag, 19.00 Uhr und Samstag, 08.30 Uhr, im Spitalbach in ein Friseurgeschäft ein. Gestohlen wurde ein Laptop im Wert von 300 €. Am Gebäude entstand ein Schaden von 200 €."
11/21/2013,Crailsheim,Crailsheim,,Michael-Rauck-Straße,"3,000",,,x,,Am Donnerstag zwischen 00.30 und 09.00 Uhr drangen Unbekannte in der Michael-Rauck-Straße über ein Fenster in ein Bistro ein. In einem Nebenraum brachen die Täter einen Zigarettenautomat auf. Schaden ca. 3000 €.
11/21/2013,Schwäbisch Hall,Schwäbisch Hall,,Schenkenseestraße,,,,x,, Unbekannte schlugen am Donnerstag zwischen 00.15 und 09.30 ein Fenster einer Gaststätte  in der Schenkenseestraße ein. Es wurde nur ein geringer Geldbetrag entwendet. Der entstandene Schaden ist noch nicht bekannt. Zeugen des Vorfalls werden gebeten sich mit dem Polizeirevier Schwäbisch Hall  in Verbindung zu setzen.
11/20/2013,Crailsheim,Crailsheim,,Bahnhofstraße,,,,x,, Mit einem Geißfuß wollten Einbrecher in der Nacht zum Mittwoch die Türe einer Gaststätte in der Bahnhofstraße aufhebeln. Sie schafften es jedoch nicht und verschwanden ohne Beute. Zurück blieb Sachschaden in Höhe von rund 100 Euro.
11/18/2013,Gaildorf,Gaildorf,,Paul-Thierfelder-Straße,"1,000",x,,,, Ein bislang unbekannter Täter brach am Montag zwischen 16 Uhr und 18.30 Uhr in eine Wohnung eines Mehrfamilienhauses in der Paul-Thierfelder-Straße ein. Er hebelte die Wohnungstüre auf und entwendete Bargeld. Der Gesamtschaden beläuft sich auf knapp 1000 Euro.
11/17/2013,Schwäbisch Hall,Schwäbisch Hall,,Steinbeisweg,,,x,,,"Am Wochenende brachen unbekannte Täter im Steinbeisweg in einen Möbelmarkt ein. Mit brachialer Gewalt wurden eine Stahltüre und eine Gartentüre aufgebrochen. Im Gebäude wurden die Arbeitsplätze, Kassen und der Aufenthaltsraum durchsucht und verschiedene Gegenstände entwendet. Der Gesamtschaden beläuft sich auf über tausend Euro."
11/17/2013,Schwäbisch Hall,Schwäbisch Hall,,Am Ripperg,600,,x,,," Am Wochenende drangen unbekannte Täter in eine Werkstatt ‚Am Ripperg‘ ein. Sie brachen ein Rolltor auf und schlugen mehrere Fensterscheiben ein. Die Werkhalle, der Aufenthaltsraum sowie mehrere Büros und Schränke wurden durchsucht. Nach dem derzeitigen Ermittlungsstand wurde nichts gestohlen. Der Sachschaden beläuft sich auf 600 Euro."
11/17/2013,Crailsheim,Crailsheim,,Wolfgangstraße,,x,,,, Ein bislang unbekannter Täter brach in der Zeit von 16 Uhr bis 21.30 Uhr in eine Wohnung in einem Mehrfamilienhaus in der Wolfgangstraße ein. Er durchsuchte das Schlafzimmer und entwendete neben Bargeld noch den Personalausweis und die EC-Karte der Wohnungsinhaberin. Es entstand ein Schaden von einigen hundert Euro.
11/17/2013,Obersontheim,Obersontheim,,Ebbachweg,,x,,,," In einem Mehrfamilienhaus im Ebbachweg, versuchte am Sonntag in der Zeit zwischen 14 Uhr und 18.30 Uhr ein Unbekannter eine Wohnung aufzubrechen. Die Eingangstüre hielt jedoch dem Aufbruchsversuch stand. An der Türe entstand ein Schaden von 300 Euro."
11/17/2013,Mainhardt,Mainhardt,,Im Seetal,,,,x,, Ein bislang unbekannter Täter brach in der Nacht zum Sonntag in einen Imbiss ‚Im Seetal‘ ein. Zunächst versuchte er die Terrassentüre aufzuhebeln. Als dies nicht gelang schlug er die Scheibe ein. Er durchsuchte den Thekenbereich und entwendete aus einer Kasse Bargeld. Aus dem Kühlschrank nahm er noch einige Dosen eines Energy-Drinks mit. Durch den Einbruch entstand ein Schaden von 1500 Euro. Ein Nachbar machte am Samstag gegen 23.45 Uhr in unmittelbarer Nähe des Imbiss eine verdächtige Wahrnehmung. Auf dem Gerüst eines Hauses hielt sich eine Person auf. Dieser versuchte offensichtlich in das Gebäude einzusteigen. Der Unbekannte flüchtete.
11/16/2013,Crailsheim,Crailsheim,,Hindenburgstraße,,x,,,,"In der Zeit vom 9. bis 16.11.13 drangen Unbekannte über eine Balkontür in ein Einfamilienhaus in der Hindenburgstraße
ein. Sie nutzen offensichtlich die Abwesenheit der Eigentümer aus und entwendeten Schmuck und Bargeld. Es entstand Schaden von 1000 €. Zeugen des Einbruchs werden gebeten sich mit dem Polizeirevier Crailsheim in Verbindung zu setzen."
11/16/2013,Schwäbisch Hall,Schwäbisch Hall,,Sulzdorfer Straße,,,x,,,In der Nacht von Freitag auf Samstag versuchten Unbekannte in der Sulzdorfer Straße die Eingangstür eines Blumenladens aufzubrechen. Es blieb jedoch beim Versuch. Die Schadenshöhe ist noch nicht bekannt. Zeugen des Vorfalls werden gebeten sich mit dem Polizeirevier Schwäbisch Hall in Verbindung zu setzen.
11/16/2013,Schwäbisch Hall,Schwäbisch Hall,,Hessentaler Straße,,x,,,Garagen,Unbekannte öffneten in der Nacht von Freitag auf Samstag mehrere Garagen im Dinkelweg und in der Alten Hessentaler Straße. Die Täter durchsuchten danach mehrere  Fahrzeuge. Ob etwas entwendet wurde ist momentan noch nicht bekannt. Zeugen wenden sich bitte unter Tel. 0791 4000 an das Polizeirevier Schwäbisch Hall.
11/15/2013,Wallhausen,Wallhausen,,Rossbürger Straße,,x,,,Gewalt," Auf Hochtouren läuft die Fahndung nach zwei flüchtigen Männern. Nach dem derzeitigen Ermittlungsstand drangen die beiden in der Nacht zum Freitag gegen 22.35 Uhr in ein Wohnhaus in der Rossbürger Straße in Michelbach an der Lücke ein. Als der 75-jährige Bewohner verdächtige Geräusche hörte, rief er über Notruf die Polizei. In diesem Augenblick überwältigten ihn die Unbekannten, fesselten ihn mit Klebeband und schlugen auf ihn ein. Zudem rissen sie das Kabel aus dem Telefon. Dann flüchteten sie mit einigen hundert Euro Bargeld. Wenig später war eine Polizeistreife vor Ort und befreite den 75-jährigen Mann, der mit leichten Verletzungen davonkam. 
Trotz einer sofort eingeleiteten Großfahndung fehlt von den beiden Tatverdächtigen bislang noch jede Spur. Die beiden Männer sind zwischen 20 und 30 Jahren alt und stammen vermutlich aus dem Bereich Rumänien. Einer von ihnen war mit einer dunklen Jeans und einer dunklen Kapuzenjacke bekleidet.
Die Kripo in Crailsheim bittet die Bevölkerung um Mithilfe.
Wer in der Nacht zum Freitag im Bereich von Michelbach an der Lücke verdächtige Personen oder Fahrzeuge beobachtet hat, möchte sich bitte unter Telefon 07951/4800 melden. Da nicht ausgeschlossen werden kann, dass das Gebäude ‚ausbaldowert‘ worden ist, sind für die Polizei auch verdächtige Beobachtungen wichtig, die vielleicht schon einige Tage zurück liegen können.   "
11/14/2013,Kressberg,Kressberg,,Ruhefeld,,x,,,," In der Zeit zwischen 13.30 Uhr und 18.45 Uhr waren am Donnerstag Langfinger in Mariäkappel im ,Ruhefeld‘ unterwegs. Sie hebelten ein Fenster auf einer Gebäuderückseite auf und gelangten so ins Haus. Im Gebäude wurden sämtliche Zimmer durchsucht und einige Schmuckgegenstände entwendet. Die genaue Schadenshöhe ist noch nicht bekannt. Die Polizei ermittelt."
11/14/2013,Schwäbisch Hall,Schwäbisch Hall,,Max-Eyth-Straße,,,,,Schule," Ein aufmerksamer Zeuge reagierte am Donnerstagabend schnell und verständigte über eine verdächtige Wahrnehmung die Polizei. Er stellte um 19.30 Uhr in einem Gebäude der Berufsschule Taschenlampenlicht fest.
Es wurden sofort mehrere Streifen mit der Überprüfung beauftragt. Sie waren rasch am Einsatzort und umstellten das Gebäude. In diesem Augenblick sprang ein Mann aus einem Fenster und flüchtete. Die Beamten waren jedoch schneller und nahmen den Flüchtenden fest. Es handelte sich um einen 27-Jährigen aus dem Hohenlohekreis. Bei der Überprüfung der Schule stellte sich heraus, dass der 27-Jährige am Abend eine Eingangstüre aufgebrochen hatte. In dem Gebäude wuchtete er einen Kaffeeautomaten auf. Er entnahm das Bargeld. Anschließend brach er zwei Bürotüren auf und durchsuchte die Räume. Dem Täter fiel Münzgeld in die Hände. Das Geld wurde sichergestellt.
Durch den Einbruch entstand ein Schaden von rund 3000 Euro. Der 27-Jährige ist geständig. Er befindet sich inzwischen wieder auf freiem Fuß."
11/12/2013,Schwäbisch Hall,Schwäbisch Hall,,Hasenbühl,"1,000",,,,Hütte, Im Gewann ‚Hasenbühl‘ brach in der Nacht zum Dienstag ein Unbekannter eine Waldhütte auf. Der Täter nahm ein Stromaggregat und eine Motorfräse mit. Das Diebesgut hat einen Wert von 1000 Euro.
11/11/2013,Schwäbisch Hall,Schwäbisch Hall,,Köberle,300,,,,, Im ‚Köberle‘ in Gelbingen versuchte am Montagnachmittag ein Unbekannter eine Haustür aufzuhebeln. Dies gelang ihm jedoch nicht. Der Schaden beläuft sich auf 300 Euro.
11/10/2013,Schwäbisch Hall,Schwäbisch Hall,,Färbergasse,,,x,,, In der Nacht zum Sonntag drückten Unbekannte in der Färbergasse ein Fenster auf und drang in einen Feinkostladen ein. Durch das Öffnen des Fensters wurde eine neuwertige Espresso-Maschine auf den Boden geworfen und total beschädigt. Die Einbrecher entwendeten aus einer Kasse Bargeld. Nachbarn hörten am Sonntagmorgen um 4.45 Uhr im Bereich der Färbergasse verdächtige Geräusche. Vermutlich waren die Täter zu diesem Zeitpunkt am Werk. Wenig später liefen drei Männer in Richtung Ackeranlagen davon. Durch den Einbruch entstand ein Schaden von mehreren hundert Euro.
11/10/2013,Schwäbisch Hall,Schwäbisch Hall,,Spitalmühlenstraße,,,,x,," In der Nacht zum Sonntag versuchte ein Unbekannter zunächst die Türe zu einem Lagerraum einer Gaststätte in der Spitalmühlenstraße aufzuhebeln. Als dies nicht gelang, brach er eine Terrassentüre auf. Anschließend durchsuchte er den Gastraum und Thekenbereich. Er entwendete eine geringe Menge Kleingeld. Danach begab sich der Unbekannte in die Lagerräume der Gaststätte und durchsuchte verschiedene Schränke und Schubladen. Bevor er die Gaststätte verließ, bereitete er sich noch mit den vorhandenen Zutaten eine Pizza zu. Aus dem Lagerraum nahm er noch verschiedene Getränke mit. Es entstand ein Schaden von einigen hundert Euro."
11/9/2013,Gottwollshausen,Gottwollshausen,,Brunnenteichstraße,,,x,,," Drei Männer  versuchten gegen 02.00 Uhr die Eingangstüre zu einem Laden aufzuhebeln. Durch den entstandenen Lärm wurden Anwohner aufmerksam und verständigten die Polizei.  Als die Täter zu Fuß die Flucht ergriffen, wurden sie noch kurze Zeit von Zeugen verfolgt, aber aus den Augen verloren. Alle drei waren dunkel und sportlich gekleidet. Über den entstandenen Sachschaden liegen noch keine Erkenntnisse vor. Die Ermittlungen hierzu dauern an."
11/7/2013,Untermünkheim,Untermünkheim,,Am Berg,,x,,,," Am Donnerstagabend drangen Unbekannte in der Zeit zwischen 18 und 20 Uhr in ein Gebäude ‚Am Berg‘ ein. Wie sie in das Haus gelangten, ist unklar. Die Eindringlinge durchsuchten mehrere Räume. Was im Einzelnen erbeutet wurde, ist noch unklar. Die Polizei ermittelt. "
11/7/2013,Schwäbisch Hall,Schwäbisch Hall,,Tilsiter Weg,700,x,,,Garagen, In der Zeit von Mittwochabend bis Donnerstagmorgen wurden ein schwarzes Trekkingrad der Marke KTM und ein weißes Trekkingrad der Marke Bulls aus einer Garage im Tilsiter Weg entwendet. Der Gesamtwert der Fahrräder beträgt 700 Euro.
11/2/2013,Gröningen,Gröningen,,Hauptstraße,300,x,,,,"In der Nacht zum Samstag  drang ein Unbekannter in ein Gebäude in Gröningen, Gröninger Hauptstraße, ein.
Das Gebäude wurde durchsucht, aber offenbar wurde nichts entwendet. Schaden 300 €."
11/2/2013,Gröningen,Gröningen,,Neuweg,,x,,,,"In der gleichen Nacht wurde ein Haus in Gröningen, im Neuweg, von einem Unbekannten heimgesucht. Der Täter entwendete Schmuck und Bargeld in bislang unbekannter Höhe."
11/2/2013,Crailsheim,Crailsheim,,Michael-Rauck-Straße,,,,x,," In der Nacht zum Samstag versuchte ein Unbekannter in eine Gaststätte in der Michael-Rauck-Straße einzudringen, scheiterte jedoch am Fenster. Schaden 500 €."
11/2/2013,Crailsheim,Crailsheim,,Michael-Rauck-Straße,,,x,,," In der Nacht zum Samstag brach ein Unbekannter in einen Club in der Michael-Rauck-Straße ein. Der Täter brach die Eingangstür auf und anschließend einen Zigarettenautomaten. Es wurden Zigaretten sowie Bargeld entwendet. Die Höhe des Schadens ist derzeit noch nicht bekannt. Auf Grund der Nähe zum ersten Objekt, dürfte es sich um den gleichen Täter gehandelt haben."
11/2/2013,Rosengarten,Rosengarten,,Sanzenbacher Straße,,,x,,,"In der Nacht von Freitag auf Samstag hebelten Unbekannte das Fenster einer Metzgerei in der Sanzenbacher Straße auf und entwendeten Bargeld.
Zeugen des Einbruchs werden gebeten sich mit dem Polizeiposten Gaildorf in Verbindung zu setzen."
11/2/2013,Satteldorf,Satteldorf,,Neuweg,,x,,,,"In der Nacht vom Freitag auf Samstag stieg ein Unbekannter über einen Balkon in den ersten Stock eines Hauses in der Straße Am Waaghäusle in Gröningen ein. Aus dem Haus wurden mehrere Schmuckstücke entwendet. Der Schaden steht bisher noch nicht fest. Vermutlich der gleiche Täter hebelte am Freitag zwischen  14.40 und 19.20 Uhr an einem Einfamilienhaus im Neuweg ein Fenster auf. Auch hier wurde Schmuck gestohlen. Weiterhin fehlt Bargeld und ein Notebook.
Zeugen der beiden Einbrüche werden gebeten sich mit dem Polizeirevier Crailsheim Hall in Verbindung zu setzen."
11/16/2013,Schwieberdingen,Schwieberdingen,,Hülbeweg,,,,,Kindergarten,"Über die aufgehebelte Terrassentür an der Südseite des Kindergartens im Hülbeweg gelangten bislang unbekannte Täter in das Gebäudeinnere, wo sie mit brachialer Gewalt die Tür zum Büro aufhebelten, dort die verschlossenen Schränke aufbrachen und Bargeld in Höhe von mehr als 2.000 Euro entwendeten. Der angerichtete Sachschaden wurde mit etwa 1.500 Euro angegeben. Die polizeilichen Ermittlungen dauern noch an.
"
12/15/2013,Besigheim,Besigheim,,Hartweg,"2,100",x,,,,"Ein bislang unbekannter Täter gelangte am Sonntag im Zeitraum zwischen 14:00 Uhr und 19:50 Uhr über ein Gartentor auf das Grundstück eines Wohnhauses im Hartweg. Zunächst versuchte der Unbekannte ein Badezimmerfenster aufzuhebeln. Da dies misslang machte er sich an einem daneben liegenden Fenster zu schaffen und verschaffte sich so Zutritt zu den Räumlichkeiten, die er anschließend durchsuchte. Auf der Suche nach Stehlenswertem hebelte er Schränke und Schubladen auf und entwendete schließlich Bargeld um Schmuck im Gesamtwert von etwa 1.100 Euro. Den Rückzug trat der Unbekannte über die Terrrassentür an.  Der angerichtete Sachschaden wurde mit etwa 1.000 Euro angegeben."
12/13/2013,Steinheim/Murr,Steinheim,,Kleinbottwarer Straße,,,,x,,"Mit leeren Händen musste ein Einbrecher von dannen ziehen, der sich am Freitag in der Zeit zwischen 01.00 Uhr und 06.15 Uhr Zutritt zu einer Gastsstätte in der Kleinbottwarer Straße verschaffte. Nachdem der Täter die Scheiben der Eingangstür eingeschlagen hatte, betrat er die Gasträume und brach einen Spielautomaten auf, um die Geldscheinkassette zu entnehmen. Zu seinem Pech hatte der Besitzer die Kassette vor Verlassen der Gaststätte geleert, so dass der Täter ohne Beute den Rückzug antreten musste. Über die Höhe des entstandenen Schadens ist bislang nichts bekannt. "
12/11/2013,Sersheim,Sersheim,,Dürer-Ring,"2,500",x,,,,"Erst nach mehreren Versuchen gelang es einem bislang unbekannten Täter am Mittwoch im Zeitraum zwischen 15:20 Uhr und 18:45 Uhr an der Südseite eines Wohnhauses im Dürer-Ring die zweiflügelige Balkontür aufzuhebeln und ins Wohnungsinnere zu gelangen. Dort durchsuchte er mehrere Räume und ließ schließlich verschiedenen Schmuck sowie Bargeld mitgehen. Der Wert des Diebesguts wurde mit etwa 2.500 Euro angegeben. Der Sachschaden an der Terrassentür wurde mit etwa 1.000 Euro beziffert. Die polizeilichen Ermittlungen dauern noch an. Hinweise nimmt das Polizeirevier Vaihingen an der Enz, Telefon 07042/941-0, entgegen."
12/11/2013,Sachsenheim,Sachsenheim,,Schulgartenstraße,"5,000",x,,,,"Ein bislang unbekannter Täter verschaffte sich am Mittwoch zwischen 17:00 Uhr und 19:15 Uhr Zutritt zu einem Wohnhaus in der Oberen Schulgartenstraße, indem er die Terrassentür aufhebelte. Im Gebäudeinneren durchsuchte er sämtliche Räumlichkeiten nach Stehlenswertem und entwendete schließlich mehrere Schmuckstücke und Bargeld im Wert von etwa 5.000 Euro. Der Sachschaden an der Terrassentür wurde mit etwa 500 Euro angegeben. Hinweise erbittet das Polizeirevier Vaihingen an der Enz, Telefon 07042/941-0."
12/7/2013,Pleidelsheim,Pleidelsheim,,Tabakweg,,x,,,,"Am Samstag in der Zeit zwischen 18:00 Uhr und 19:30 Uhr gelangten bislang unbekannte Täter in ein Wohnhaus im Tabakweg, indem sie die Terrassentür auf der Südseite aufhebelten. Im Gebäudeinneren durchsuchten die Einbrecher mehrere Räumlichkeiten und entwendeten Bargeld und Schmuck. Der Wert des Diebesguts konnte noch nicht näher beziffert werden. Der entstandene Sachschaden an der Terrassentür wurde mit etwa 200 Euro angegeben. Zeugen, die Verdächtiges wahrgenommen haben, werden gebeten sich mit dem Polizeiposten Freiberg am Neckar unter Telefon 07141/643780 in Verbindung zu setzen."
12/6/2013,Sachsenheim,Sachsenheim,,Fuchsweg,,x,,,,"Im Verlauf der letzten Woche verschaffte sich ein bislang unbekannter Täter Zutritt zu einem Wohnhaus im Fuchsweg, indem er die hintere Terrassentür aufhebelte. Im Gebäudeinneren durchsuchte der Unbekannte mehrere Räumlichkeiten und ließ eine Spardose mit mehreren Hundert Euro Bargeld und eine externe Festplatte im Wert von etwa 50 Euro mitgehen. Die Flucht trat der Einbrecher wieder über die geöffnete Terrassentür an.  Hinweise nimmt das Polizeirevier Vaihingen an der Enz, Telefon 07042/941-0, entgegen."
12/4/2013,Remseck/Neckar,Remseck,,John-F.-Kennedy-Allee,,,x,,,"Indem er in der Nacht von Dienstag auf Mittwoch die Schiebetür aufhebelte, verschaffte sich ein bislang unbekannter Täter Zugang zu einem Ladengeschäft in der John-F.-Kennedy-Allee und entwendete zielstrebig etwa 300 Euro Bargeld aus einer geöffneten Kasse. Hinweise nimmt das Polizeirevier Kornwestheim, Telefon 07154/1313-0, entgegen."
12/3/2013,Bietigheim-Bissingen,Bietigheim-Bissingen,,Im Vogelsang,,x,,,,"Am Dienstag zwischen 15:00 Uhr und 19:00 Uhr hebelte ein bislang unbekannter Täter die rückwärtige Terrassentür eines Wohnhauses in der Straße ""Im Vogelsang"" auf und durchsuchte einige Räume nach Stehlenswertem. Er öffnete Schränke und Behältnisse und ließ mehrere Schmuckstücke im Wert von etwa 1.500 Euro mitgehen. Im weiteren Verlauf seiner Diebestour suchte er anschließend auch das Nachbarhaus auf. Dort wuchtete er ebenfalls die Terrassentür auf, gelangte so in das Gebäudeinnere und durchsuchte die Wohnräume. Über Art und Umfang des Diebesguts ist derzeit noch nichts bekannt. Die polizeilichen Ermittlungen dauern an. Hinweise nimmt das Polizeirevier Bieitigheim-Bissingen, Telefon 07142/405-0, entgegen."
