Wann?,Wo?,Ort,Ortsteil,Strasse,Schaden?,Privat,Firma,Gaststätte,Sonstige,Meldung
1/25/2014,Sachsenheim,Sachsenheim,Kleinsachsenheim,Hudelweg,,,,,Kindergarten,"Unbekannte Täter gelangten in der Nacht von Freitag auf Samstag, nach Aufhebeln eines Fensters, in einen Kindergarten im Ortsteil Kleinsachsenheim und entwendeten aus zwei Geldkassetten Bargeld in noch unbekannter Höhe. Hierzu hebelten die Täter im Gebäude noch zwei Türen auf, so dass ein Sachschaden von rund 1.000 Euro entstand."
1/26/2014,Sachsenheim,Sachsenheim,,Goethestraße,,,,,Kindergarten,"Indem er die Haupteingangstür aufhebelte, verschaffte sich ein bislang unbekannter Einbrecher in der Zeit zwischen Freitag 18:30 Uhr und Sonntag 11:10 Uhr Zutritt zu einem Kindergarten in der Goethestraße. In den Räumlichkeiten brach er mehrere Schrankfächer und einen Schreibtisch auf und suchte nach Stehlenswertem. Dabei fielen ihm etwa 150 Euro Bargeld in die Hände. Er hinterließ einen Sachschaden in Höhe von ungefähr 1.000 Euro. Hinweise nimmt das Polizeirevier Vaihingen an der Enz, Telefon 07042/941-0, entgegen."
1/26/2014,Möglingen,Möglingen,,Beim Hasenkreuz,"1,000",x,,,,"Aus einer Tiefgarage in der Straße ""Beim Hasenkreuz"" entwendeten bislang unbekannte Täter am Sonntag in der Zeit zwischen 05:00 Uhr und 14:20 Uhr einen Satz Alu-Kompletträder im Wert von etwa 1.000 Euro. Die Räder waren auf einem Parkplatz vor dem Fahrzeug gelagert. Die polizeilichen Ermittlungen dauern an. Hinweise nimmt das Polizeirevier Kornwestheim, Telefon 07154/1313-0, entgegen."
1/25/2014,Sachsenheim,Sachsenheim,,Hudelweg,,,,,Kindergarten,"Eine geringe Menge Bargeld erbeutete ein Einbrecher, der sich in der Zeit zwischen Freitag und Montag Zutritt zu einem Kindergarten im Hudelweg verschaffte. Der Täter hebelte ein Fenster auf und stieg in die Räumlichkeiten ein. Anschließend brach er mehrere Schließfächer und einen Schrank auf. Aus einer vorgefundenen Geldkassette entnahm er das Geld und verließ die Örtlichkeit. Der entstandene Schaden beläuft sich auf etwa 200 Euro."
1/25/2014,Bietigheim-Bissingen,Bietigheim-Bissingen,,Flattichstraße,,,,,Kindergarten,"Vermutlich ohne Diebesgut zog ein bislang unbekannter Täter von dannen, nachdem er am vergangenen Wochenende in einen Kindergarten in der Flattichstraße eingestiegen war. Indem er ein Fenster aufhebelte gelangte er in das Gebäudeinnere und durchsuchte einen Büroraum, ohne etwas mitgehen zu lassen. Es entstand ein Sachschaden von etwa 250 Euro."
1/27/2014,Möglingen,Möglingen,,Panoramaweg,,x,,,,"Ziemlich unverfroren gingen bislang unbekannte Diebe vor, als sie sich in der Nacht von Sonntag auf Montag über die Sammeltiefgarage eines Mehrfamilienhauses im Panoramaweg Zutritt in das Gebäude verschafften. Anschließend begaben sie sich in den Waschmaschinenraum im Untergeschoss und entwendeten eine neuwertige Waschmaschine plus Wärmepumpentrockner der Marke Siemens im Wert von je 600 Euro. Der Abtransport des Diebesguts erfolgte vermutlich ebenfalls über die Tiefgarage. Hinweise nimmt der Polizeiposten Möglingen, Telefon 07141/481291 oder das Polizeirevier Kornwestheim, Telefon 07154/1313-0, entgegen."
1/28/2014,Sachsenheim,Sachsenheim,,Zwischen den Wegen,,,x,,,"Auf Baumaschinen abgesehen hatte es ein bislang unbekannter Täter im Zeitraum zwischen Samstag 09:00 Uhr und Dienstag 07:30 Uhr als er sich Zutritt zu der Lagerhalle in der Straße ""Zwischen den Wegen"" verschaffte. Nachdem er den Metallbügel des Vorhängeschlosses abgeschnitten hatte, betrat er die Halle und entwendete die Geräte im Wert von mehr als 2.500 Euro. Hinweise nimmt das Polizeirevier Vaihingen/Enz, Telefon 07042/941-0, entgegen."
1/27/2014,Sachsenheim,Sachsenheim,,Bahnhofstraße,,,,x,,"Vermutlich auf der Suche nach Bargeld befanden sich unbekannte Einbrecher, die sich am Montag in der Zeit zwischen 01:00 Uhr und 09:00 Uhr Zutritt zu einer Gaststätte in der Bahnhofstraße verschafften. Mit brachialer Gewalt hebelten sie eine Tür auf, um in die Gasträume zu gelangen. Dort brachen sie Geldspielautomaten auf und entwendeten die Geldboxen sowie das enthaltene Münzgeld. Die leeren Geldboxen konnten in der näheren Umgebung wieder aufgefunden werden. Über die Höhe des entwendeten Bargelds liegen bislang noch keine Erkenntnisse vor. Der entstandene Sachschaden beläuft sich auf etwa 1.000 Euro. Zeugen werden gebeten sich mit dem Polizeiposten Sachsenheim unter Telefon 07147/27406-0 in Verbindung zu setzen."
1/26/2014,Möglingen,Möglingen,,Beim Hasenkreuz,,x,,,,"Mutmaßlich ein- und dieselben Täter entwendeten aus einer Gemeinschaftstiefgarage in der Straße ""Beim Hasenkreuz"" am Wochenende Alu-Kompletträder mit Sommerbereifung der Marken Mazda, Lancia und Opel im Gesamtwert von über 3.000 Euro. Die polizeilichen Ermittlungen dauern an. Hinweise nimmt der Polizeiposten Möglingen, Telefon 07141/481291, entgegen."
1/28/2014,Benningen,Benningen,,Am Viadukt,,,,x,,"Indem er den Zaun überstieg gelangte ein bislang unbekannter Täter am Dienstag gegen 03:15 Uhr auf das Gelände des Hundesportvereins am Viadukt und hebelte die Eingangstür des Vereinsheims auf, um in das Gebäudeinnere zu gelangen. Aus einer Kasse ließ er Wechselgeld mitgehen und geriet im weiteren Verlauf seiner Diebestour an einen Karton Süßigkeiten, den er ebenfalls kurzerhand mitnahm. Der Wert des Diebesgutes wurde mit etwa 70 Euro angegeben. Der angerichtete Sachschaden wurde auf etwa 200 Euro geschätzt. Hinweise nimmt das Polizeirevier Marbach am Neckar, Telefon 07144/900-0, entgegen."
1/29/2014,Asperg,Asperg,,Lehenstraße,,x,,,,"Zunächst versuchte ein bislang unbekannter Einbrecher am Mittwoch zwischen 17:30 Uhr und 18:20 Uhr vergeblich die Balkontür eines Wohnhauses in der Lehenstraße aufzuhebeln. Als dies misslang wandte er sich der Terrassentür zu und brach diese kurzerhand auf. Im Wohnungsinneren durchsuchte er die Räumlichkeiten und ließ Bargeld und Schmuck mitgehen. Der Wert des Diebesguts konnte noch nicht angegeben werden. Der entstandene Sachschaden wurde mit etwa 1.000 Euro beziffert. Zeugen, die Verdächtiges wahrgenommen haben werden gebeten, sich mit dem Polizeiposten Asperg, Telefon 07141/62033, in Verbindung zu setzen."
2/1/2014,Sinsheim,Sinsheim,,Muthstraße,,x,,,,"Zwei Einbrüche registrierte die Sinsheimer Polizei über das zurückliegende Wochenende. Zwischen Samstag, 13 Uhr und Sonntag, 14 Uhr drangen bislang nicht ermittelte Täter durch Aufhebeln der Eingangstüre in ein Geschäft in der Muthstraße ein und erbeuteten eine Registrierkasse mit mehreren hundert Euro Wechselgeld. Bei der näheren Absuche - u.a. auch im Postgarten - wurde von dem Beamten des Sinsheimer Polizeireviers die Kasse in einem Gebüsch aufgefunden; die einzelnen Geldbehälter lagen bei einer Parkbank. Die Ermittlungen dauern noch an. "
2/1/2014,Sinsheim,Sinsheim,,Muthstraße,,,x,,,"Ein weiterer Einbruch ereignete sich in der Nacht zum Sonntag zwischen 2 Uhr und 8 Uhr in einem Sonnenstudio, ebenfalls in der Muthstraße. Über ein aufgehebeltes Fenster stiegen die Unbekannten ein und ließen Bargeld in Höhe von mehr als 1.000 Euro mitgehen. Möglicherweise handelt es sich bei beiden Einbrüchen um ein- und denselben Täter. Zeugen, die sachdienliche Hinweise geben können, werden gebeten, sich unter Tel.: 07261/6900 zu melden."
1/28/2014,Heilbronn,Heilbronn,,Asperger Straße,,,,,Kindergarten,"Der Kindergarten in der Heilbronner Asperger Straße war in der Nacht zum Dienstag das Ziel eines bislang unbekannten Einbrechers. Der Täter wuchtete zunächst ein Fenster auf und konnte so in das Innere des Gebäudes gelangen. Dort wurden sämtliche Behältnisse durchwühlt. Außer, dass dem Unbekannten etwas Bargeld indie Hände fiel, richtete er auch noch eine Sachschaden in Höhe von mehreren hundert Euro an. Sachdienliche Hinweise nimmt die Polizei Heilbronn-Kirchhausen unter der Tel.Nr.: 07131 94010 entgegen."
1/29/2014,Bretzfeld,Bretzfeld,,Ackermannstraße,,x,,,,Mit der Aufklärung mehrerer Einbrüche ist die Polizei Bretzfeld derzeit beschäftigt. In der Nacht zum Mittwoch trieben dort vermutlich zwei bislang Unbekannte ihr Unwesen. So wurden in der Ackermannstraße in die Vereinsräume einer Pfadfindergruppe eingebrochen. Die Täter hatten dazu ein Fenster aufgehebelt und konnten so in das Innere der Räumlichkeiten gelangen. Dort wurden sämtliche Behältnisse durchsucht. Insgesamt fielen den Täter bei diesem Beutezug rund 200 Euro Bargeld in die Hände. Der angerichtete Sachschaden beläuft sich auf knapp 1.000 Euro.
1/29/2014,Bretzfeld,Bretzfeld,,Ackermannweg,,,,,Kindergarten," In der gleichen Nacht und der gleichen Straße wurde in den katholischen Kindergarten eingebrochen. Auch hier wurde ein Fenster aufgehebelt und im Gebäudeinnern offenbar gezielt nach Bargeld gesucht. Falls die Täter auf eine reiche Beute gehofft hatten, blieb dieser Wunsch glücklicherweise unerfüllt. Lediglich einen recht geringen Bargeldbetrag konnten die Diebe mitgehen lassen. Der angerichtete Sachschaden beträgt in diesem Fall mindestens 1.000 Euro. Die Kindertagesstätte in der Steinsfeldstraße blieb ebenfalls nicht unbehelligt. Nach der gleichen Vorgehensweise wurde auch dort nach Geld gesucht. Nur wenige Euro fielen den Unbekannten in die Hände. Der Sachschaden beläuft sich hier auf mehrere hundert Euro. Beim Einbruch in den Kindergarten in der Humboldtstraße hatten die Täter wiederum ein Fenster aufgehebelt und im Gebäudeinnern alles durchsucht. Da offenbar kein Bargeld zu finden war, wurde ein Büroraum brachial aufgebrochen und eine alte, antiquarische Nähmaschine der Marke Gritzner, Typ VG, gestohlen. Danach verschwanden die Unbekannten vermutlich durch die Terrassentür. Die Polizei Bretzfeld bittet dringend um Hinweise, die zur Ermittlung der Täter führen. Sachdienliche Angaben werden unter der Tel.Nr.: 07946 940-010 entgegengenommen."
1/30/2014,Leingarten,Leingarten,,Heilbronner Straße,,,x,,,Eine Firma in der Heilbronner Straße in Leingarten war in der Nacht zum Donnerstag das Ziel eines bislang unbekannten Einbrechers. Der Täter hatte dort ein Fenster aufgewuchtet und konnte so in das Innere des Gebäudes gelangen. Sämtliche Räume und Behältnisse wurden durchsucht. Dem Einbrecher fiel ein niedriger vierstelliger Eurobetrag in die Hände. Der angerichtete Sachschaden beläuft sich auf über 1.000 Euro. Sachdienliche Hinweise nimmt die Polizei Leintal unter der Tel.Nr.: 07138 81063-0 entgegen.
2/1/2014,Schwaigern,Schwaigern,,Weststraße,,,,,Schule,"In der Nacht von Freitag auf Samstag brachen unbekannte Täter in die Grundschule in Schwaigern in der Weststraße ein. Zugang verschafften sich die Täter über ein Fenster im Lehrerzimmer. Dort wurden sämtliche Schränke aufgebrochen. Ebenso wurde das Zimmer zum Sekretariat und das Rektorzimmer aufgebrochen, sowie weitere verschlossene Klassenzimmer und darin befindliche Schränke. Der angerichtete Sachschaden ist weitaus höher als das erbeutete Diebesgut, ein Notebook im Wert von einigen hundert Euro. Hinweise bitte an das Polizeirevier Lauffen, Tel.Nr. 07133/2090"
2/2/2014,Kirchardt,Kirchardt,,Kettendstraße,,,,x,,"Ein Clubhaus in der Kirchardter Kettendstraße war in der Nacht zum Sonntag das Ziel eines bislang unbekannten Einbrechers. Der Täter wuchtete zunächst ein Fenster auf und konnte so in das Innere des Gebäudes gelangen. Von dort ließ der Einbrecher ein Fernsehgerät, mehrere Flaschen Whiskey und Münzgeld in noch unbekannter Höhe mitgehen. Sachdienliche Hinweise nimmt die Polizei Eppingen unter der Telefon 07262 6095-0 entgegen."
2/2/2014,Heilbronn,Heilbronn,,Zehentgasse,,,,x,,"In eine Heilbronner Gaststätte in der Zehentgasse drangen in der Nacht zum Sonntag unbekannte Täter ein. In der Zeit zwischen Sonntag, 2.30 Uhr und 10 Uhr, verschafften sie sich über die Haupteingangstür gewaltsam Zugang zum Gastraum. Anschließend hebelten sie zwei Kellertüren sowie die Metalltür zum Getränkelager auf. Schließlich fanden sie einen Tresor, den sie mit Brachialgewalt von der Wand stemmten und komplett mitnahmen. Zudem entwendeten die Einbrecher eine vorgefundene Geldkassette. Der Sach- und Diebstahlschaden ist fünfstellig. Zeugen, die zur Tatzeit im Bereich der Osteria etwas Verdächtiges beobachtet haben, sollten sich beim Polizeirevier Heilbronn, Telefon 07131 104 2500, melden."
2/2/2014,Schwaigern,Schwaigern,,Obelisk,,,,,Kindergarten,"In den Kindergarten ""Obelisk"" in Schwaigern drangen am vergangenen Wochenende Einbrecher ein. Sie hatten zuvor ein über den Garten zugängliches Fenster aufgebrochen und sich anschließend in den Räumlichkeiten umgesehen. Sie brachen dort mehrere Schränke auf und entnahmen schließlich aus einer vorgefundenen Geldkassette einen geringeren Bargeldbetrag. Über die Terrasse verließen die Täter den Kindergarten. Der von ihnen angerichtete Sachschaden übersteigt den Wert ihrer Beute bei weitem. Das Polizeirevier Lauffen nimmt unter der Telefonnummer 07133 2090 Hinweise zu dem Einbruch entgegen."
2/2/2014,Heilbronn,Heilbronn,,Achtungstraße,,,,x,,"Eine Gaststätte in der Heilbronner Achtungstraße war am Sonntag, gegen 02.00 Uhr, das Ziel eines bislang unbekannten Einbrechers. Der Täter hatte zunächst versucht, ein Fenster aufzuwuchten, ließ dann aber von seinem Vorhaben ab und machte sich an der Eingangstür zu schaffen. Allerdings scheiterte sein Einbruchsversuch, sodass der Unbekannte unverrichteter Dinge den Tatort verließ. Die Höhe des angerichteten Sachschadens ist derzeit noch nicht bekannt. Sachdienliche Hinweise nimmt die Polizei Heilbronn unter der Tel.Nr.: 07131 104-2500 entgegen."
2/3/2014,Möckmühl,Möckmühl,,Ruchsener Straße,,x,,,,"Ein Gartenhaus in der Ruchsener Straße in Möckmühl, war in der Nacht zum Montag das Ziel eines Einbrechers. Der Unbekannte hatte das Fenster des Häuschens aufgebrochen und konnte so in das Innere des Raumes gelangen. Von dort ließ der Täter eine Bohrmaschine und zwei Flaschen Schnaps mitgehen. Sachdienliche Hinweise nimmt die Polizei Möckmühl unter der Tel.Nr.: 06298 92000 entgegen."
2/3/2014,Abstatt,Abstatt,,Happenbacher Straße,,,x,,,"Eine Großbaustelle in der Happenbacher Straße in Abstatt war in der Zeit von Samstag, 15.15 Uhr bis Montag, 08.00 Uhr, das Ziel eines unbekannter Einbrechers. Der Täter hatte gewaltsam ein Eingangstor geöffnet und hatte es auf die dort gelagerten Sprieße abgesehen. Es handelt sich dabei um die Menge von rund 400 Stück, mit einem Gesamtwert von rund 40.000 Euro. Zum Abtransport muss mit großer Wahrscheinlichkeit ein Lkw verwendet worden sein. Das Gesamtgewicht des Diebesgutes dürfte bei etwa 12 Tonnen liegen. Der angerichtete Sachschaden liegt bei rund 1.000 Euro. Sachdienliche Hinweise nimmt die Polizei Weinsberg unter der Tel.Nr.: 07134 992-0 entgegen."
2/2/2014,Schwaigern,Schwaigern,,Schloßstraße,,,,,Kindergarten,"Ein bislang Unbekannter suchte, in der Zeit von Freitagnachmittag bis Sonntag, drei Kindergärten in Schwaigern heim. An dem Gebäude in der Schloßstraße hatte der Täter ein Fenster aufgebrochen und konnte so in das Innere des Kindergartens eindringen. Dort wuchten noch weitere Behältnisse und Schränke gewaltsam geöffnet. Vermutlich fand der Einbrecher nichts für ihn Stehlenswertes vor. Der angerichtete Sachschaden beläuft sich allerdings auf rund 1.500 Euro."
2/2/2014,Schwaigern,Schwaigern,,Gratstraße,,,,,Kindergarten," Im gleichen Tatzeitraum erhielt auch der Kindergarten in der Gratstraße ungebetenen Besuch. Wiederum drang der Einbrecher durch ein aufgewuchtetes Fenster in das Gebäude ein, wo eine Tür gewaltsam geöffnet wurde. Auch in diesem Fall wurde vermutlich nichts gestohlen. Die Höhe des angerichteten Sachschadens steht noch nicht fest. Sachdienliche Hinweise nimmt die Polizei Lauffen unter der Tel.Nr.: 07133 209-0 entgegen."
2/2/2014,Mosbach,Mosbach,,Neuburgstraße,,,,,Kindergarten,Der Kindergarten in der Neckarelzer Neuburgstraße war in der Zeit von Samstag bis Montagmorgen das Ziel eines Unbekannten. Der Täter hatte in dieser Zeit ein Fenster aufgebrochen und gelangte so in das Innere des Gebäudes. Mehrere Behältnisse wurde dort gewaltsam geöffnet. Dem Einbrecher fiel dabei eine relativ geringe Summe Bargeld in die Hände. Sachdienliche Hinweise nimmt die Polizei Mosbach unter der Tel.Nr.: 06261 809-0 entgegen.
2/2/2014,Schwaigern,Schwaigern,,Weststraße,,,,,Schule,"Nach zwei Einbrüchen in einen Kindergarten sowie in die Grundschule in Schwaigern wurde dem Polizeiposten Leintal nun eine weitere, gleichgelagerte Tat gemeldet. Im Zeitraum zwischen Freitagabend, 18 Uhr, und Samstag, 4:50 Uhr, waren Unbekannte in die Sonnenberg-Förderschule in der Weststraße eingedrungen und hatten sich anschließend ebenfalls gewaltsam Zugang zu mehreren Innenräumen verschafft. Dabei erlangten sie Bargeld und nahmen eine Bankkarte mit. Mit dieser gelang es den Tätern mehrfach Geld abzuheben. Der Sach- und Diebstahlschaden liegt im fünfstelligen Euro-Bereich. Sachdienliche Hinweise zu den drei Taten nimmt die Polizei in Leintal, Telefon 07138 810630, entgegen."
2/3/2014,Künzelsau,Künzelsau,,Frankenweg,,x,,,,"Ein Einbrecher war am Montag, zwischen 14 und 18 Uhr, in einem Künzelsauer Alterswohnsitz im Frankenweg aktiv. Der Täter betrat in diesem Zeitraum das Zimmer einer Bewohnerin und hatte dabei offenbar gleich geeignetes Werkzeug mitgebracht um den darin befindlichen Schreibtisch aufzuwuchten. Daraus entnahm er eine schwarze Geldtasche mit der Aufschrift ""Volksbank"", in der sich Bargeld befand. Die Polizei sucht nun Zeugen, die im genannten Zeitraum verdächtige Beobachtungen in dem Seniorenheim gemacht haben. Hinweise bitte unter Telefon 07940 9400."
2/4/2014,Eppingen,Eppingen,,Elsenzstraße,,,x,,,Auf den Lebensmittelladen beim Eppinger Asylbewerberheim in der Elsenzstraße hatte es in der Zeit von Sonntag bis Dienstag ein bislang Unbekannter abgesehen. Der Täter wuchtete dort ein Fenster auf und konnte so in den Verkaufsraum gelangen. Dort ließ der Einbrecher Lebensmittel und Süßigkeiten im Wert von etwa 150 Euro mitgehen. Sachdienliche Hinweise nimmt die Polizei Eppingen unter der Tel.Nr.: 07262 6095-0 entgegen
1/30/2014,Bietigheim-Bissingen,Bietigheim-Bissingen,,Bietweg,,x,,,,"Gleich in drei Fällen schlugen bislang unbekannte Einbrecher im Laufe des Donnerstag im Wohngebiet ""Lug"" sowie einmal im ""Buch"" zu. Dabei erbeuteten sie aus einem Wohnhaus im Bietweg Diebesgut mit einem Wert im niederen vierstelligen Bereich. Indem sie in der Zeit zwischen 16:20 Uhr und 21:45 Uhr ein Fenster aufhebelten, gelang es ihnen in die Räumlichkeiten einzusteigen und nach den Wertsachen zu suchen. Der entstandene Schaden beläuft sich auf etwa 500 Euro. "
1/30/2014,Bietigheim-Bissingen,Bietigheim-Bissingen,,Hindenburgstraße,,x,,,,"Bereits am Vormittag, in der Zeit zwischen 07:45 Uhr und 12:20 Uhr, suchten unbekannte Täter ein Wohnhaus in der Hindenburgstraße heim. Dabei verschafften sie sich über eine Tür zwischen Garage und Wohngebäude Zutritt zu den Wohnräumen, die sie auf der Suche nach Wertvollem durchwühlten und unter anderem eine Digitalkamera und Schmuck entwendeten. Der Wert der Gegenstände konnte bislang noch nicht beziffert werden. Der Schaden an der Tür wurde mit etwa 1.000 Euro angegeben. Einen Schaden in Höhe von ungefähr 500 Euro ließen Einbrecher an einem Wohnhaus in der Schmidbleicherstraße zurück, als sie in der Zeit zwischen 17:45 Uhr und 20:30 Uhr durch Aufhebeln eines Fensters in das Gebäudeinnere gelangten. Obwohl die Täter auch hier nach Wertvollem suchten, nahmen sie vermutlich nichts mit."
1/30/2014,Bietigheim-Bissingen,Bietigheim-Bissingen,,Frimleystraße,,x,,,," Ebenfalls ohne Beute zogen Einbrecher aus einem Haus in der Frimleystraße von dannen, in das sie in der Zeit zwischen 15:00 Uhr und 18:00 Uhr einstiegen. Dabei hebelten sie die Terrassentür auf, um in das Innere zu gelangen und nach Diebesgut Ausschau zu halten. Der an der Tür entstandene Schaden wurde mit etwa 500 Euro angegeben. Das Polizeirevier Bietigheim-Bissingen bittet in allen Fällen Zeugen, die verdächtige Wahrnehmungen gemacht haben, sich unter Telefon 07142/405-0 zu melden."
2/2/2014,Oberstenfeld,Oberstenfeld,,Robert-Bosch-Straße,,,x,,,"Vermutlich auf Bargeld und Zigaretten abgesehen hatten es bislang Unbekannte, als sie im Zeitraum zwischen Sonntag 19:00 Uhr und Montag etwa 08:50 Uhr in einen Getränkemarkt in der Robert-Bosch-Straße eindrangen. Über die frei zugängliche Gebäuderückseite gelangten die Täter auf das Firmengelände und arbeiteten sich bis zu einem Fenster im Obergeschoss vor, das sie kurzerhand aufhebelten, um in die Räumlichkeiten einzusteigen. In einem Büroraum durchwühlten sie sämtliche Schränke und Schubladen und ließen Bargeld in Höhe von mehreren Hundert und verschiedene Scheckkarten mitgehen. Im weiteren Verlauf ihrer Diebestour fielen ihnen im Verkaufsraum 150 Schachteln Zigaretten im Wert von etwa 750 Euro in die Hände, die sie mitgehen ließen. Der angerichtete Sachschaden wurde mit etwa 200 Euro beziffert. Die polizeilichen Ermittlungen dauern an. Hinweise nimmt der Polizeiposten Großbottwar unter Telefon 07148/1625-0 entgegen."
2/3/2014,Besigheim,Besigheim,,Sachsenheimer Steige,,x,,,,"Schmuck im Wert von mehreren Hundert Euro fiel einem unbekannten Einbrecher in die Hände, der am Montag in der Zeit zwischen 15:45 Uhr und 19:00 Uhr ein Wohngebäude in der Sachsenheimer Steige heimsuchte. Der Täter hebelte die Terrassentür auf und gelangte auf diese Weise in die Wohnräume, die er anschließend durchsuchte. An der Terrassentür entstand ein Schaden in Höhe von etwa 800 Euro. Zeugen werden gebeten sich mit dem Polizeiposten Besigheim unter Tel. 07143/40508 in Verbindung zu setzen."
2/4/2014,Bietigheim-Bissingen,Bietigheim-Bissingen,,Bahnhofstraße,,,,x,,"Einen Kiosk in der Bahnhofstraße suchte ein unbekannter Täter am Dienstag kurz vor 03:30 Uhr heim, indem er zunächst den Rolladen aufhebelte, um anschließend die Fensterscheibe mit einem Stein einzuwerfen. Er stieg in den Verkaufsraum ein und ließ etwa 20 Zigarettenstangen im Wert von mehreren Hundert Euro mitgehen. Personen, die Verdächtiges bemerkt haben, werden gebeten, sich mit dem Polizeirevier Bietigheim-Bissingen, Telefon 07142/405-0, in Verbindung zu setzen."
2/4/2014,Besigheim,Besigheim,,Türkengasse,,x,,,,"Im Zeitraum zwischen 08:10 Uhr und 16:10 Uhr versuchte ein bislang unbekannter Täter am Dienstag die Tür einer Wohnung in der Türkengasse aufzuhebeln. Da ihm dies nicht gelang trat er sie kurzerhand ein und gelangte auf diese Weise in das Wohnungsinnere. Dort durchsuchte er sämtliche Zimmer und ließ Bargeld in Höhe von mehreren Hundert Euro sowie ein Computerspiel samt Spielen ebenfalls mit einem Wert von mehreren Hundert Euro mitgehen. Der Sachschaden an der Wohnungstür wurde mit etwa 300 Euro angegeben. Hinweise nimmt der Polizeiposten Besigheim, Telefon 07143/40508-0, entgegen."
2/6/2014,Jettingen,Jettingen,,Marktplatz,,,x,,Bäckerei,"Nach dem Hinweis eines aufmerksamen Passanten hat die Polizei in der Nacht zum Donnerstag drei Georgier im Alter von 24, 25 und 39 Jahren nach einem Einbruch in eine Bäckerei am Marktplatz in Oberjettingen festgenommen. Der Zeuge hatte das Trio gegen 02:00 Uhr beim Aufhebeln der Eingangstür beobachtet und sofort die Polizei alarmiert. Nur drei Minuten nach Eingang der Meldung waren Polizeibeamte vor Ort und konnten die Tatverdächtigen vorläufig festnehmen. Sie hatten bereits etwa 70 Schachteln Zigaretten in einen Plastiksack gepackt und zum Abtransport bereitgelegt. Während der 25-Jährige bislang noch nicht polizeilich in Erscheinung getreten ist, waren die beiden anderen bereits wegen Eigentumsdelikten und der 39-Jährige zudem wegen Verstoßes gegen das Betäubungsmittelgesetz anhängig. Auf Antrag der Staatsanwaltschaft Stuttgart wurden die drei Tatverdächtigen am Donnerstag dem Haftrichter beim Amtsgericht Böblingen vorgeführt, der Haftbefehl gegen sie erlassen und sie in eine Justizvollzugsanstalt eingewiesen hat."
2/4/2014,Schwäbisch Hall,Schwäbisch Hall,,,,x,,,,Mit brachialer Gewalt versuchte ein Unbekannter über die Haustüre und ein daneben befindliches Fenster in ein leerstehendes Wohnhaus in der Straße Im Vogelsang einzudringen. Der hinterlassene Sachschaden beläuft sich auf ca. 1000 Euro. Der Einbruch wurde am Dienstag angezeigt. Die Tat selbst war zwischen Samstag und Dienstag.
2/6/2014,Mainhardt,Mainhardt,,Am Moosbach,,,x,,,"Ein vorbeifahrender Verkehrsteilnehmer meldete in der Nacht zum Donnerstag der Haller Polizei, dass an einem Geschäft Am Moosbach der Alarmmelder in Betrieb ist. Die Polizei stellte fest, dass in der Zeit vor 2.30 Uhr eine rote Rundummeldung abgeschlagen und akustische Signalgeber beschädigt worden waren. An einem Nebeneingang wurde erfolglos versucht die Tür aufzubrechen, danach wurde die Haupteingangstür eingedrückt. Ob die Täter aus dem laden etwas entwendet haben, muss zusammen mit dem Betreiber noch geklärt werden. Zeugen, die im Tatortbereich in der Nacht von Mittwoch auf Donnerstag etwas beobachtet haben, was mit der tat in Verbindung zu bringen ist, werden gebeten, sich bei der Polizei in Schwäbisch hall (0791/4000) zu melden."
2/6/2014,Schwäbisch Hall,Schwäbisch Hall,,Crailsheimer Straße,,,x,,,In der Crailsheimer Straße versuchten in der Nacht zum Donnerstag unbekannte Täter in einen Getränkemarkt einzubrechen. Sie probierten mit einem Stein eine Scheibe neben der elektronischen Eingangstüre des Getränkemarktes einzuschlagen. Nachdem dies misslang wurde an der zweiflügeligen Türe gehebelt. Die Türe wurde hierdurch erheblich beschädigt. Der oder die Täter gelangten letztendlich nicht in den Markt. Schaden ca. 1000 Euro.
